{
  "$schema": "https://json-schema.org/draft/2020-12/schema",
  "$id": "https://proofpath.dev/schemas/action-proof-envelope.v0.1.schema.json",
  "title": "ProofPath Action Proof Envelope v0.1",
  "type": "object",
  "additionalProperties": false,
  "required": [
    "protocol",
    "envelope_id",
    "created_at",
    "intent",
    "authority",
    "causal_context",
    "proposal",
    "execution",
    "observed_result",
    "witnesses",
    "verification",
    "evidence_integrity"
  ],
  "properties": {
    "protocol": {
      "type": "object",
      "additionalProperties": false,
      "required": ["schema_version", "profile_id"],
      "properties": {
        "schema_version": {"const": "0.1.0"},
        "profile_id": {"const": "proofpath.poci.v0.1"}
      }
    },
    "envelope_id": {"$ref": "#/$defs/id"},
    "created_at": {"$ref": "#/$defs/timestamp"},
    "intent": {
      "type": "object",
      "additionalProperties": false,
      "required": [
        "intent_id",
        "principal_id",
        "action_kind",
        "statement",
        "valid_from",
        "expires_at",
        "nonce",
        "signature_ref"
      ],
      "properties": {
        "intent_id": {"$ref": "#/$defs/id"},
        "principal_id": {"$ref": "#/$defs/id"},
        "action_kind": {"$ref": "#/$defs/actionKind"},
        "statement": {"type": "string", "minLength": 1, "maxLength": 4096},
        "valid_from": {"$ref": "#/$defs/timestamp"},
        "expires_at": {"$ref": "#/$defs/timestamp"},
        "nonce": {"type": "string", "pattern": "^[A-Za-z0-9._:-]{8,128}$"},
        "signature_ref": {"$ref": "#/$defs/artifactRef"}
      }
    },
    "authority": {
      "type": "object",
      "additionalProperties": false,
      "required": [
        "grant_id",
        "principal_id",
        "agent_id",
        "executor_id",
        "action_kind",
        "scope",
        "reversibility",
        "approval_required"
      ],
      "properties": {
        "grant_id": {"$ref": "#/$defs/id"},
        "principal_id": {"$ref": "#/$defs/id"},
        "agent_id": {"$ref": "#/$defs/id"},
        "executor_id": {"$ref": "#/$defs/id"},
        "action_kind": {"$ref": "#/$defs/actionKind"},
        "scope": {
          "type": "array",
          "minItems": 1,
          "uniqueItems": true,
          "items": {"type": "string", "pattern": "^[a-z0-9][a-z0-9._:-]{0,127}$"}
        },
        "budget": {
          "oneOf": [
            {"type": "null"},
            {"$ref": "#/$defs/budget"}
          ]
        },
        "reversibility": {"enum": ["reversible", "compensatable", "irreversible"]},
        "approval_required": {"type": "boolean"},
        "approval_ref": {
          "oneOf": [
            {"type": "null"},
            {"$ref": "#/$defs/artifactRef"}
          ]
        }
      }
    },
    "causal_context": {
      "type": "object",
      "additionalProperties": false,
      "required": ["required", "parent_type", "parent_id", "parent_digest", "relationship"],
      "properties": {
        "required": {"type": "boolean"},
        "parent_type": {"enum": ["decision", "receipt", "policy", "request", "none"]},
        "parent_id": {
          "oneOf": [
            {"type": "null"},
            {"$ref": "#/$defs/id"}
          ]
        },
        "parent_digest": {
          "oneOf": [
            {"type": "null"},
            {"$ref": "#/$defs/digest"}
          ]
        },
        "relationship": {"enum": ["authorizes", "depends_on", "continues", "remediates", "none"]}
      }
    },
    "proposal": {
      "type": "object",
      "additionalProperties": false,
      "required": ["proposal_id", "agent_id", "action_kind", "scope", "parameters_digest", "proposed_at"],
      "properties": {
        "proposal_id": {"$ref": "#/$defs/id"},
        "agent_id": {"$ref": "#/$defs/id"},
        "action_kind": {"$ref": "#/$defs/actionKind"},
        "scope": {"type": "array", "minItems": 1, "uniqueItems": true, "items": {"type": "string"}},
        "parameters_digest": {"$ref": "#/$defs/digest"},
        "proposed_at": {"$ref": "#/$defs/timestamp"}
      }
    },
    "execution": {
      "type": "object",
      "additionalProperties": false,
      "required": ["status", "executor_id", "proposal_id", "started_at", "completed_at", "receipt_ref", "receipt_digest"],
      "properties": {
        "status": {"enum": ["not_executed", "succeeded", "failed", "unknown"]},
        "executor_id": {"$ref": "#/$defs/id"},
        "proposal_id": {"$ref": "#/$defs/id"},
        "started_at": {"oneOf": [{"type": "null"}, {"$ref": "#/$defs/timestamp"}]},
        "completed_at": {"oneOf": [{"type": "null"}, {"$ref": "#/$defs/timestamp"}]},
        "receipt_ref": {"oneOf": [{"type": "null"}, {"$ref": "#/$defs/artifactRef"}]},
        "receipt_digest": {"oneOf": [{"type": "null"}, {"$ref": "#/$defs/digest"}]}
      }
    },
    "observed_result": {
      "type": "object",
      "additionalProperties": false,
      "required": ["status", "observer_id", "observed_at", "result_kind", "result_ref", "result_digest"],
      "properties": {
        "status": {"enum": ["not_observed", "observed", "inconclusive"]},
        "observer_id": {"$ref": "#/$defs/id"},
        "observed_at": {"oneOf": [{"type": "null"}, {"$ref": "#/$defs/timestamp"}]},
        "result_kind": {"type": "string", "pattern": "^[a-z0-9][a-z0-9._:-]{0,127}$"},
        "result_ref": {"oneOf": [{"type": "null"}, {"$ref": "#/$defs/artifactRef"}]},
        "result_digest": {"oneOf": [{"type": "null"}, {"$ref": "#/$defs/digest"}]}
      }
    },
    "witnesses": {
      "type": "array",
      "minItems": 1,
      "maxItems": 64,
      "items": {
        "type": "object",
        "additionalProperties": false,
        "required": ["witness_id", "verdict", "reason_codes", "statement_ref", "statement_digest", "evaluated_at"],
        "properties": {
          "witness_id": {"$ref": "#/$defs/id"},
          "verdict": {"enum": ["ACCEPT", "HOLD", "BLOCK", "CHALLENGE"]},
          "reason_codes": {"type": "array", "uniqueItems": true, "items": {"$ref": "#/$defs/reasonCode"}},
          "statement_ref": {"$ref": "#/$defs/artifactRef"},
          "statement_digest": {"$ref": "#/$defs/digest"},
          "evaluated_at": {"$ref": "#/$defs/timestamp"}
        }
      }
    },
    "verification": {
      "type": "object",
      "additionalProperties": false,
      "required": ["verifier_id", "decision", "primary_reason_code", "reason_codes", "verified_at"],
      "properties": {
        "verifier_id": {"$ref": "#/$defs/id"},
        "decision": {"enum": ["ACCEPT", "HOLD", "BLOCK", "CHALLENGE"]},
        "primary_reason_code": {"oneOf": [{"type": "null"}, {"$ref": "#/$defs/reasonCode"}]},
        "reason_codes": {"type": "array", "uniqueItems": true, "items": {"$ref": "#/$defs/reasonCode"}},
        "verified_at": {"$ref": "#/$defs/timestamp"}
      }
    },
    "evidence_integrity": {
      "type": "object",
      "additionalProperties": false,
      "required": ["hash_algorithm", "canonicalization_profile", "artifacts", "envelope_root"],
      "properties": {
        "hash_algorithm": {"const": "sha256"},
        "canonicalization_profile": {"const": "proofpath.poci.canonical-json.v0.1"},
        "artifacts": {"type": "array", "minItems": 1, "items": {"$ref": "#/$defs/artifactRef"}},
        "envelope_root": {"oneOf": [{"type": "null"}, {"$ref": "#/$defs/digest"}]}
      }
    },
    "extensions": {
      "type": "object",
      "propertyNames": {"pattern": "^[a-z0-9][a-z0-9.-]{2,127}$"},
      "additionalProperties": true
    }
  },
  "$defs": {
    "id": {"type": "string", "pattern": "^[A-Za-z0-9][A-Za-z0-9._:-]{2,127}$"},
    "timestamp": {"type": "string", "format": "date-time", "pattern": "^\\d{4}-\\d{2}-\\d{2}T\\d{2}:\\d{2}:\\d{2}Z$"},
    "digest": {"type": "string", "pattern": "^sha256:[0-9a-f]{64}$"},
    "reasonCode": {"type": "string", "pattern": "^[A-Z][A-Z0-9_]{2,95}$"},
    "actionKind": {"type": "string", "pattern": "^[a-z0-9][a-z0-9._:-]{2,127}$"},
    "budget": {
      "type": "object",
      "additionalProperties": false,
      "required": ["asset", "max_amount_minor"],
      "properties": {
        "asset": {"type": "string", "pattern": "^[A-Z0-9][A-Z0-9._:-]{1,31}$"},
        "max_amount_minor": {"type": "integer", "minimum": 0}
      }
    },
    "artifactRef": {
      "type": "object",
      "additionalProperties": false,
      "required": ["artifact_id", "role", "media_type", "digest"],
      "properties": {
        "artifact_id": {"$ref": "#/$defs/id"},
        "role": {"type": "string", "pattern": "^[a-z0-9][a-z0-9._:-]{2,127}$"},
        "media_type": {"type": "string", "minLength": 3, "maxLength": 127},
        "byte_length": {"type": ["integer", "null"], "minimum": 0},
        "digest": {"$ref": "#/$defs/digest"},
        "path": {"type": ["string", "null"], "maxLength": 512}
      }
    }
  }
}
