{"protocol":{"schema_version":"0.1.0","profile_id":"proofpath.poci.v0.1"},"envelope_id":"env_result_digest_mismatch","created_at":"2026-07-31T00:00:00Z","intent":{"intent_id":"intent_ok_001","principal_id":"principal_demo","action_kind":"compute.inference.purchase","statement":"Purchase one bounded inference job.","valid_from":"2026-07-31T00:00:00Z","expires_at":"2026-07-31T01:00:00Z","nonce":"nonce-demo-0001","signature_ref":{"artifact_id":"sig_001","role":"intent.signature","media_type":"application/json","digest":"sha256:1111111111111111111111111111111111111111111111111111111111111111"}},"authority":{"grant_id":"grant_001","principal_id":"principal_demo","agent_id":"agent_demo","executor_id":"executor_demo","action_kind":"compute.inference.purchase","scope":["compute.inference.once"],"reversibility":"compensatable","approval_required":false},"causal_context":{"required":true,"parent_type":"decision","parent_id":"decision_001","parent_digest":"sha256:2222222222222222222222222222222222222222222222222222222222222222","relationship":"authorizes"},"proposal":{"proposal_id":"proposal_001","agent_id":"agent_demo","action_kind":"compute.inference.purchase","scope":["compute.inference.once"],"parameters_digest":"sha256:3333333333333333333333333333333333333333333333333333333333333333","proposed_at":"2026-07-31T00:05:00Z"},"execution":{"status":"succeeded","executor_id":"executor_demo","proposal_id":"proposal_001","started_at":"2026-07-31T00:06:00Z","completed_at":"2026-07-31T00:06:03Z","receipt_ref":{"artifact_id":"receipt_001","role":"execution.receipt","media_type":"application/json","digest":"sha256:4444444444444444444444444444444444444444444444444444444444444444"},"receipt_digest":"sha256:4444444444444444444444444444444444444444444444444444444444444444"},"observed_result":{"status":"observed","observer_id":"observer_demo","observed_at":"2026-07-31T00:06:04Z","result_kind":"text.summary","result_ref":{"artifact_id":"result_001","role":"observed.result","media_type":"application/json","digest":"sha256:5555555555555555555555555555555555555555555555555555555555555555"},"result_digest":"sha256:8888888888888888888888888888888888888888888888888888888888888888"},"witnesses":[{"witness_id":"witness_001","verdict":"CHALLENGE","reason_codes":["RESULT_DIGEST_MISMATCH"],"statement_ref":{"artifact_id":"witness_stmt_001","role":"witness.statement","media_type":"application/json","digest":"sha256:6666666666666666666666666666666666666666666666666666666666666666"},"statement_digest":"sha256:6666666666666666666666666666666666666666666666666666666666666666","evaluated_at":"2026-07-31T00:07:00Z"}],"verification":{"verifier_id":"proofpath_ref","decision":"CHALLENGE","primary_reason_code":"RESULT_DIGEST_MISMATCH","reason_codes":["RESULT_DIGEST_MISMATCH"],"verified_at":"2026-07-31T00:07:01Z"},"evidence_integrity":{"hash_algorithm":"sha256","canonicalization_profile":"proofpath.poci.canonical-json.v0.1","artifacts":[{"artifact_id":"sig_001","role":"intent.signature","media_type":"application/json","digest":"sha256:1111111111111111111111111111111111111111111111111111111111111111"},{"artifact_id":"receipt_001","role":"execution.receipt","media_type":"application/json","digest":"sha256:4444444444444444444444444444444444444444444444444444444444444444"},{"artifact_id":"result_001","role":"observed.result","media_type":"application/json","digest":"sha256:5555555555555555555555555555555555555555555555555555555555555555"},{"artifact_id":"witness_stmt_001","role":"witness.statement","media_type":"application/json","digest":"sha256:6666666666666666666666666666666666666666666666666666666666666666"}],"envelope_root":null},"extensions":{}}
