{
  "protocol": {
    "schema_version": "0.1.0",
    "profile_id": "proofpath.poci.v0.1"
  },
  "envelope_id": "env_demo_accept_001",
  "created_at": "2026-07-31T00:00:00Z",
  "intent": {
    "intent_id": "intent_demo_compute_001",
    "principal_id": "principal_alex_demo",
    "action_kind": "compute.inference.purchase",
    "statement": "Purchase one bounded inference job for the approved demo.",
    "valid_from": "2026-07-31T00:00:00Z",
    "expires_at": "2026-07-31T01:00:00Z",
    "nonce": "nonce-demo-0001",
    "signature_ref": {
      "artifact_id": "artifact_intent_signature",
      "role": "intent.signature",
      "media_type": "application/json",
      "byte_length": 128,
      "digest": "sha256:1111111111111111111111111111111111111111111111111111111111111111",
      "path": "bundle/intent-signature.json"
    }
  },
  "authority": {
    "grant_id": "grant_demo_compute_001",
    "principal_id": "principal_alex_demo",
    "agent_id": "agent_demo_runner",
    "executor_id": "executor_mock_compute",
    "action_kind": "compute.inference.purchase",
    "scope": [
      "compute.inference.demo.once"
    ],
    "budget": {
      "asset": "USD",
      "max_amount_minor": 500
    },
    "reversibility": "compensatable",
    "approval_required": false,
    "approval_ref": null
  },
  "causal_context": {
    "required": true,
    "parent_type": "decision",
    "parent_id": "decision_budget_approved_001",
    "parent_digest": "sha256:2222222222222222222222222222222222222222222222222222222222222222",
    "relationship": "authorizes"
  },
  "proposal": {
    "proposal_id": "proposal_demo_compute_001",
    "agent_id": "agent_demo_runner",
    "action_kind": "compute.inference.purchase",
    "scope": [
      "compute.inference.demo.once"
    ],
    "parameters_digest": "sha256:3333333333333333333333333333333333333333333333333333333333333333",
    "proposed_at": "2026-07-31T00:05:00Z"
  },
  "execution": {
    "status": "succeeded",
    "executor_id": "executor_mock_compute",
    "proposal_id": "proposal_demo_compute_001",
    "started_at": "2026-07-31T00:06:00Z",
    "completed_at": "2026-07-31T00:06:03Z",
    "receipt_ref": {
      "artifact_id": "artifact_execution_receipt",
      "role": "execution.receipt",
      "media_type": "application/json",
      "byte_length": 128,
      "digest": "sha256:4444444444444444444444444444444444444444444444444444444444444444",
      "path": "bundle/execution-receipt.json"
    },
    "receipt_digest": "sha256:4444444444444444444444444444444444444444444444444444444444444444"
  },
  "observed_result": {
    "status": "observed",
    "observer_id": "observer_demo_001",
    "observed_at": "2026-07-31T00:06:04Z",
    "result_kind": "text.summary",
    "result_ref": {
      "artifact_id": "artifact_observed_result",
      "role": "observed.result",
      "media_type": "application/json",
      "byte_length": 128,
      "digest": "sha256:5555555555555555555555555555555555555555555555555555555555555555",
      "path": "bundle/result.json"
    },
    "result_digest": "sha256:5555555555555555555555555555555555555555555555555555555555555555"
  },
  "witnesses": [
    {
      "witness_id": "witness_demo_001",
      "verdict": "ACCEPT",
      "reason_codes": [],
      "statement_ref": {
        "artifact_id": "artifact_witness_statement",
        "role": "witness.statement",
        "media_type": "application/json",
        "byte_length": 128,
        "digest": "sha256:6666666666666666666666666666666666666666666666666666666666666666",
        "path": "bundle/witness-statement.json"
      },
      "statement_digest": "sha256:6666666666666666666666666666666666666666666666666666666666666666",
      "evaluated_at": "2026-07-31T00:07:00Z"
    }
  ],
  "verification": {
    "verifier_id": "proofpath_reference_verifier",
    "decision": "ACCEPT",
    "primary_reason_code": null,
    "reason_codes": [],
    "verified_at": "2026-07-31T00:07:01Z"
  },
  "evidence_integrity": {
    "hash_algorithm": "sha256",
    "canonicalization_profile": "proofpath.poci.canonical-json.v0.1",
    "artifacts": [
      {
        "artifact_id": "artifact_intent_signature",
        "role": "intent.signature",
        "media_type": "application/json",
        "byte_length": 128,
        "digest": "sha256:1111111111111111111111111111111111111111111111111111111111111111",
        "path": "bundle/intent-signature.json"
      },
      {
        "artifact_id": "artifact_execution_receipt",
        "role": "execution.receipt",
        "media_type": "application/json",
        "byte_length": 128,
        "digest": "sha256:4444444444444444444444444444444444444444444444444444444444444444",
        "path": "bundle/execution-receipt.json"
      },
      {
        "artifact_id": "artifact_observed_result",
        "role": "observed.result",
        "media_type": "application/json",
        "byte_length": 128,
        "digest": "sha256:5555555555555555555555555555555555555555555555555555555555555555",
        "path": "bundle/result.json"
      },
      {
        "artifact_id": "artifact_witness_statement",
        "role": "witness.statement",
        "media_type": "application/json",
        "byte_length": 128,
        "digest": "sha256:6666666666666666666666666666666666666666666666666666666666666666",
        "path": "bundle/witness-statement.json"
      }
    ],
    "envelope_root": null
  },
  "extensions": {}
}
